MCQ,Choices,Correct
What is the field of study in artificial intelligence concerned with the development and study of statistical algorithms that can learn from data and generalise to unseen data?,a: Machine learning | b: Computer vision | c: Natural language processing | d: Email filtering,a
Which class of statistical algorithms has surpassed many previous machine learning approaches in performance?,a: Decision trees | b: Support vector machines | c: Neural networks | d: Linear regression,c
What is the related field of study focusing on exploratory data analysis via unsupervised learning?,a: Predictive analytics | b: Artificial intelligence | c: Data mining | d: Mathematical optimization,c
Who coined the term 'machine learning' in 1959?,a: Donald Hebb | b: Tom M. Mitchell | c: Arthur Samuel | d: Warren McCulloch,c
What is the main objective of modern-day machine learning?,a: To classify data based on models | b: To predict future outcomes | c: Both a and b | d: None of the above,c
