MCQ,Choices,Correct
What is the field of study in artificial intelligence concerned with the development and study of statistical algorithms that can learn from data and generalise to unseen data?,a: Neuroscience | b: Machine Learning | c: Genetics | d: Physics,b
Which class of statistical algorithms has surpassed many previous machine learning approaches in performance?,a: Decision Trees | b: Support Vector Machines | c: Neural Networks | d: Linear Regression,c
In which field does machine learning find applications such as natural language processing and computer vision?,a: Agriculture | b: Medicine | c: Speech Recognition | d: Email Filtering,c
What is the related field of study focusing on exploratory data analysis via unsupervised learning?,a: Data Mining | b: Genomics | c: Biochemistry | d: Ecology,a
"According to Tom M. Mitchell, what is the definition of machine learning in terms of tasks, experience, and performance measure?",a: A computer program learns from experience and improves performance based on tasks and measures | b: A computer program learns from textbooks and exams | c: A computer program learns from observation and trial and error | d: A computer program learns from lectures and presentations,a
